{
  "triage_recommendation": "ready_for_human_review",
  "exposure_signal": "unknown",
  "decision_readiness_score": 90,
  "decision_readiness_label": "review_ready",
  "voyage": {
    "chokepoint": "strait_of_hormuz"
  },
  "exposure_facets": [
    "ownership_or_control"
  ],
  "supplied_sources": [
    "vessel_registry_extract",
    "pi_insurance_certificate",
    "ownership_or_control_evidence",
    "sanctions_list_extract",
    "ais_track_record",
    "flag_registry_record",
    "sts_transfer_evidence",
    "cargo_or_bl_evidence"
  ],
  "minimum_sources_before_review": [],
  "evidence_gaps": [],
  "top_exposure_dimensions": [
    "indirect ownership or control exposure"
  ],
  "chokepoint_disruption_watch": [
    "Strait of Hormuz transit advisory or security incident",
    "Iran IRGC interdiction or detention report",
    "war-risk premium or underwriter advisory change for the transit area"
  ],
  "watch_next": [
    "new OFAC vessel or entity designation",
    "new EU or UK OFSI shipping-related listing",
    "P&I club cover withdrawal or confirmation change",
    "flag-registry deregistration or flag-hopping report",
    "AIS gap, spoofing, or dark-activity report on the vessel"
  ],
  "human_review_required": true,
  "not_advice_notice": "Maritime sanctions and chokepoint-disruption evidence triage only. Not legal, sanctions, compliance, financial, investment, insurance, or trading advice. Does not resolve vessel ownership or verify identity.",
  "limitations": [
    "Triage is based on caller-supplied evidence only; this service does not retrieve sources, resolve vessel ownership, or verify vessel identity.",
    "A name match against a sanctions list is not legal-entity or vessel-identity verification. Human review is required."
  ],
  "source_record_review": {
    "policy_version": "source-records.v1",
    "scope": "reference_metadata_only",
    "source_content_verified": false,
    "freshness_verified": false,
    "usable_source_types": [
      "vessel_registry_extract",
      "pi_insurance_certificate",
      "ownership_or_control_evidence",
      "sanctions_list_extract",
      "ais_track_record",
      "flag_registry_record",
      "sts_transfer_evidence",
      "cargo_or_bl_evidence"
    ],
    "issues": [],
    "next_action": "Verify source content, issuer, recency and relevance before relying on this reference coverage."
  },
  "readiness_contract": {
    "profile": "gulf_maritime_exposure",
    "status": "review_ready",
    "score": 90,
    "routing": {
      "field": "triage_recommendation",
      "value": "ready_for_human_review"
    },
    "signal": {
      "field": "exposure_signal",
      "value": "unknown"
    },
    "blocking_gaps": [],
    "non_blocking_gaps": [],
    "claim_audit": [],
    "owner_actions": [],
    "watch_next": [
      "new OFAC vessel or entity designation",
      "new EU or UK OFSI shipping-related listing",
      "P&I club cover withdrawal or confirmation change",
      "flag-registry deregistration or flag-hopping report",
      "AIS gap, spoofing, or dark-activity report on the vessel"
    ],
    "human_review_required": true,
    "boundary_notice": "Maritime sanctions and chokepoint-disruption evidence triage only. Not legal, sanctions, compliance, financial, investment, insurance, or trading advice. Does not resolve vessel ownership or verify identity."
  },
  "next_action": "review",
  "decision_kind": "evidence_review",
  "authorization_granted": false,
  "score_kind": "evidence_readiness"
}
